{
  "schema": "ucc.promotion",
  "schema_version": 1,
  "id": "ver_01K0A6R4V8W6E3M4M8Y0R9J2QP",
  "created_at": "2026-08-22T12:00:00.000Z",
  "created_by": "act_01K0A6R4V8W6E3M4M8Y0R9J2QA",
  "record_version": 1,
  "source_entity": {
    "kind": "artifact_revision",
    "id": "rev_01K0A6R4V8W6E3M4M8Y0R9J2QR"
  },
  "destination_entity": {
    "kind": "publication",
    "id": "pub_01K0A6R4V8W6E3M4M8Y0R9J2QB"
  },
  "status": "promoted",
  "promoted_at": "2026-08-22T12:00:00.000Z",
  "promoted_by": "act_01K0A6R4V8W6E3M4M8Y0R9J2QA"
}
